{
  "version": "1.0.0",
  "cam_reference": {
    "cam_version": "1.0.0",
    "board": "ICSE",
    "class": 5,
    "subject": "Mathematics"
  },
  "topic_id": "T02.01",
  "topic_name": "Addition and Subtraction",
  "canonical_explanation": {
    "text": "Addition combines two or more numbers to get a sum. Subtraction finds the difference between numbers. Addition has commutative property (order does not matter) and associative property (grouping does not matter). Subtraction can be verified by adding the difference to the smaller number.",
    "rules": [
      "Commutative: a + b = b + a",
      "Associative: (a + b) + c = a + (b + c)",
      "Subtraction verification: Difference + Subtrahend = Minuend",
      "Estimation: Round numbers before calculating"
    ]
  },
  "questions": [
    {
      "question_id": "T02.01.Q001",
      "concept_id": "T02.01.C01",
      "difficulty": "familiarity",
      "cognitive_level": "recall",
      "type": "mcq",
      "question_text": "What is 4,56,789 + 2,34,567?",
      "options": [
        {
          "id": "A",
          "text": "6,91,356"
        },
        {
          "id": "B",
          "text": "6,81,356"
        },
        {
          "id": "C",
          "text": "6,91,256"
        },
        {
          "id": "D",
          "text": "6,90,356"
        }
      ],
      "correct_answer": "A",
      "explanation_correct": "To find the sum of 4,56,789 and 2,34,567, we simply need to add the numbers together. The sum of these two numbers is 6,91,356, which is option A.",
      "explanation_incorrect": "Option A, 6,91,356, is the correct answer. To get this, we added 4,56,789 and 2,34,567 together. Options B, C, and D are incorrect because they do not represent the correct sum of these two numbers."
    },
    {
      "question_id": "T02.01.Q002",
      "concept_id": "T02.01.C01",
      "difficulty": "familiarity",
      "cognitive_level": "recall",
      "type": "fill_blank",
      "question_text": "7,00,000 - 3,45,678 = ___",
      "correct_answer": "3,54,322",
      "explanation_correct": "To find the difference between 7,00,000 and 3,45,678, we subtract the smaller number from the larger number. This gives us the answer 3,54,322, which is the correct difference between the two numbers.",
      "explanation_incorrect": "The accepted answer format for this question is 3,54,322. However, if you try to subtract 3,45,678 from 7,00,000 without properly aligning the place values, you might get the wrong answer. Make sure to line up the numbers correctly and subtract each place value starting from the right to get the correct difference of 3,54,322."
    },
    {
      "question_id": "T02.01.Q003",
      "concept_id": "T02.01.C01",
      "difficulty": "application",
      "cognitive_level": "recall",
      "type": "mcq",
      "question_text": "Calculate: 5,67,890 + 1,23,456 - 2,34,567",
      "options": [
        {
          "id": "A",
          "text": "4,56,779"
        },
        {
          "id": "B",
          "text": "4,56,789"
        },
        {
          "id": "C",
          "text": "4,56,879"
        },
        {
          "id": "D",
          "text": "4,55,779"
        }
      ],
      "correct_answer": "A",
      "explanation_correct": "The correct answer is A) 4,56,779. To get this, we first add 5,67,890 and 1,23,456, which gives us 6,91,346. Then we subtract 2,34,567 from 6,91,346, which gives us the final answer of 4,56,779.",
      "explanation_incorrect": "The incorrect answers B) 4,56,789, C) 4,56,879, and D) 4,55,779 are wrong because they do not correctly calculate the addition and subtraction in the problem. The correct step-by-step working is to first add 5,67,890 and 1,23,456, which gives 6,91,346, and then subtract 2,34,567 from this to get the final answer of 4,56,779."
    },
    {
      "question_id": "T02.01.Q004",
      "concept_id": "T02.01.C02",
      "difficulty": "application",
      "cognitive_level": "scenario",
      "type": "mcq",
      "question_text": "A school has 2,345 boys and 1,987 girls. How many students are there in total?",
      "options": [
        {
          "id": "A",
          "text": "4,232"
        },
        {
          "id": "B",
          "text": "4,332"
        },
        {
          "id": "C",
          "text": "4,322"
        },
        {
          "id": "D",
          "text": "4,432"
        }
      ],
      "correct_answer": "B",
      "explanation_correct": "The correct answer is B) 4,332 because we can add the number of boys (2,345) and the number of girls (1,987) to get the total number of students in the school, which is 4,332.",
      "explanation_incorrect": "The incorrect answer is A) 4,232. This is because the total number of students is found by adding the number of boys (2,345) and the number of girls (1,987), which gives us 4,332, not 4,232."
    },
    {
      "question_id": "T02.01.Q005",
      "concept_id": "T02.01.C02",
      "difficulty": "exam_style",
      "cognitive_level": "scenario",
      "type": "mcq",
      "question_text": "Rahul had Rs 5,00,000. He spent Rs 2,34,567 on a car and Rs 1,45,890 on furniture. How much money does he have left?",
      "options": [
        {
          "id": "A",
          "text": "Rs 1,19,543"
        },
        {
          "id": "B",
          "text": "Rs 1,19,453"
        },
        {
          "id": "C",
          "text": "Rs 1,20,543"
        },
        {
          "id": "D",
          "text": "Rs 1,18,543"
        }
      ],
      "correct_answer": "A",
      "explanation_correct": "The correct answer is A) Rs 1,19,543. Rahul had Rs 5,00,000 to start with. He then spent Rs 2,34,567 on a car and Rs 1,45,890 on furniture. To find the amount of money he has left, we need to subtract these two amounts from the original Rs 5,00,000. This gives us Rs 1,19,543 left.",
      "explanation_incorrect": "The incorrect answers B) Rs 1,19,453, C) Rs 1,20,543, and D) Rs 1,18,543 are not correct because they do not match the correct calculation. The correct way to find the amount of money Rahul has left is to subtract the two amounts he spent (Rs 2,34,567 and Rs 1,45,890) from the original Rs 5,00,000 he had."
    },
    {
      "question_id": "T02.01.Q006",
      "concept_id": "T02.01.C03",
      "difficulty": "familiarity",
      "cognitive_level": "recall",
      "type": "mcq",
      "question_text": "Estimate 4,876 + 3,245 by rounding to the nearest hundred:",
      "options": [
        {
          "id": "A",
          "text": "8,000"
        },
        {
          "id": "B",
          "text": "8,100"
        },
        {
          "id": "C",
          "text": "8,200"
        },
        {
          "id": "D",
          "text": "7,900"
        }
      ],
      "correct_answer": "B",
      "explanation_correct": "The correct answer is B) 8,100. When we round 4,876 to the nearest hundred, we get 4,900. And when we round 3,245 to the nearest hundred, we get 3,200. Adding these two rounded numbers gives us 4,900 + 3,200 = 8,100.",
      "explanation_incorrect": "The other options are incorrect because they do not accurately estimate the sum of 4,876 and 3,245 when rounded to the nearest hundred. Option A) 8,000 is too low, option C) 8,200 is too high, and option D) 7,900 is also too low. To estimate the sum correctly, we need to round each number to the nearest hundred first, and then add the rounded numbers."
    },
    {
      "question_id": "T02.01.Q007",
      "concept_id": "T02.01.C03",
      "difficulty": "application",
      "cognitive_level": "recall",
      "type": "mcq",
      "question_text": "Estimate 78,456 - 42,678 by rounding to the nearest thousand:",
      "options": [
        {
          "id": "A",
          "text": "35,000"
        },
        {
          "id": "B",
          "text": "36,000"
        },
        {
          "id": "C",
          "text": "37,000"
        },
        {
          "id": "D",
          "text": "34,000"
        }
      ],
      "correct_answer": "A",
      "explanation_correct": "The correct answer is A) 35,000. When we round 78,456 to the nearest thousand, it becomes 78,000. When we round 42,678 to the nearest thousand, it becomes 43,000. The estimated difference is 78,000 - 43,000 = 35,000.",
      "explanation_incorrect": "To estimate by rounding to the nearest thousand: 78,456 rounds to 78,000 and 42,678 rounds to 43,000. The estimated difference is 78,000 - 43,000 = 35,000. Options B (36,000), C (37,000), and D (34,000) do not match this calculation."
    },
    {
      "question_id": "T02.01.Q008",
      "concept_id": "T02.01.C04",
      "difficulty": "familiarity",
      "cognitive_level": "recall",
      "type": "mcq",
      "question_text": "Which property of addition is shown: 567 + 234 = 234 + 567?",
      "options": [
        {
          "id": "A",
          "text": "Associative property"
        },
        {
          "id": "B",
          "text": "Commutative property"
        },
        {
          "id": "C",
          "text": "Distributive property"
        },
        {
          "id": "D",
          "text": "Identity property"
        }
      ],
      "correct_answer": "B",
      "explanation_correct": "The commutative property of addition shows that the order of the addends (numbers being added) does not matter. In the expression 567 + 234, the order can be switched to 234 + 567 and the sum will remain the same.",
      "explanation_incorrect": "The associative property of addition shows that the grouping of the addends does not matter. For example, (5 + 3) + 2 = 5 + (3 + 2). The distributive property allows you to break down one number into parts and then add them. The identity property states that adding 0 to a number does not change its value. None of these properties are shown in the given expression, so the correct answer is the commutative property."
    },
    {
      "question_id": "T02.01.Q009",
      "concept_id": "T02.01.C04",
      "difficulty": "application",
      "cognitive_level": "recall",